{
  "schema_version": "1.0",
  "run_id": "example-001",
  "plan_sha256": "sha256:1e7f42901a226b8fbeee2a49c4e92483a3b524743e5ab8d59d989e8cb981b2ec",
  "remediation_pass": 0,
  "step_results": [
    {
      "step_id": "inspect",
      "status": "completed",
      "evidence": [
        "Reviewed project instructions and identified the implementation boundary."
      ]
    },
    {
      "step_id": "implement",
      "status": "completed",
      "evidence": [
        "Implemented the change and ran focused checks."
      ]
    }
  ],
  "deviations": [],
  "validation_evidence": [
    "Focused checks passed."
  ]
}
